{
  "version": "1.0",
  "title": "欢迎来到 Drama Studio",
  "total_duration_seconds": 28,
  "speakers": [
    {
      "id": "spk_周屿",
      "display_name": "周屿",
      "character_bible_id": "char_周屿"
    },
    {
      "id": "spk_林夏",
      "display_name": "林夏",
      "character_bible_id": "char_林夏"
    }
  ],
  "sections": [
    {
      "id": "s1",
      "label": "林夏：别回那通电话。",
      "text": "周屿：太晚了。信号已经发出去了。",
      "start_seconds": 0,
      "end_seconds": 12
    },
    {
      "id": "s2",
      "label": "空荡的便利店灯管闪了一下。林夏把手机扣在柜台上。",
      "text": "林夏：我们还有最后三分钟。\n周屿：够改写结局吗？",
      "start_seconds": 0,
      "end_seconds": 16
    }
  ],
  "dialogue_beats": [
    {
      "id": "d1",
      "speaker_id": "spk_周屿",
      "section_id": "s1",
      "text": "太晚了。信号已经发出去了。"
    },
    {
      "id": "d2",
      "speaker_id": "spk_林夏",
      "section_id": "s2",
      "text": "我们还有最后三分钟。"
    },
    {
      "id": "d3",
      "speaker_id": "spk_周屿",
      "section_id": "s2",
      "text": "够改写结局吗？"
    }
  ]
}
